[
  {
    "id": "magenais.decision-score",
    "name": "DecisionScore",
    "version": "1.0.0",
    "description": "Explainable multi-criteria decision intelligence: ranks options against weighted criteria and reports how stable that ranking is (Decision Stability Index) and how much a weight would need to change to flip it (Decision Flip Point).",
    "author": {
      "name": "MAGENAIS",
      "organization": "MAGENAIS"
    },
    "type": "algorithm",
    "capabilities": ["decision-ranking", "sensitivity-analysis"],
    "runtimes": ["builtin-local"],
    "repository": "https://github.com/MAGENAIS/MAGENAIS-MODEL-DECISION-SCORE",
    "license": {
      "type": "Apache-2.0",
      "url": "https://www.apache.org/licenses/LICENSE-2.0"
    },
    "pricing": {
      "type": "free"
    },
    "trust": "magenais-verified",
    "uri": "magenais://decision-score@1.0.0",
    "documentation": "https://github.com/MAGENAIS/MAGENAIS-MODEL-DECISION-SCORE#readme"
  }
]
